{
  "entry_id": "0000000000000000000000000000000000000000000000000000000000000000",
  "reviewer": "REPLACE_WITH_ACTUAL_REVIEWER",
  "organization": "REPLACE_WITH_REAL_ORGANIZATION",
  "relationship": "unknown",
  "conflicts": [],
  "verdict": "inconclusive",
  "rationale": "TEMPLATE ONLY. Record the actual review, including disagreement and limitations.",
  "reviewed_at": "2026-09-22T12:00:00Z",
  "evidence": [{"reference": "REPLACE_WITH_REVIEW_EVIDENCE", "sha256": "0000000000000000000000000000000000000000000000000000000000000000"}],
  "replication_entry_id": null
}
